{
  "$schema": "../schema/configuration.json",
  "meta": {
    "timestamp": "2022-02-06T13:38:23.313850+00:00",
    "sources": [
      "https://github.com/sannybuilder/data",
      "https://github.com/sannybuilder/library"
    ]
  },
  "version": "gtasa_ps2",
  "parent": "gtasa",
  "commands": {
    "0x0a49": {
      "name": "DO_DEBUG_STUFF",
      "flags": [
        "condition"
      ],
      "format": "  NOP_false",
      "desc": "Returns true for Xbox versions of the game"
    }
  },
  "debug": {
    "unsupported": []
  }
}
